{
  "format": "ai-model-tool",
  "version": "3.0",
  "name": "example_cnn",
  "description": "示例：简单 CNN (3通道 -> 32 -> 64 -> 10类)",
  "graph": {
    "nodes": [
      { "id": 1, "type": "conv2d", "name": "Stem Conv", "params": { "in_channels": 3, "out_channels": 32, "kernel_size": 3, "stride": 1, "padding": 1 }, "position": { "x": 60, "y": 100 } },
      {
        "id": 2,
        "type": "sequential",
        "name": "Feature Block",
        "params": {},
        "position": { "x": 450, "y": 100 },
        "execution": "sequence",
        "children": [
          { "id": 3, "type": "relu", "name": "ReLU", "params": {} },
          { "id": 4, "type": "maxpool2d", "name": "MaxPool2d", "params": { "kernel_size": 2, "stride": 2 } },
          { "id": 5, "type": "conv2d", "name": "Conv2d", "params": { "in_channels": 32, "out_channels": 64, "kernel_size": 3, "stride": 1, "padding": 1 } },
          { "id": 6, "type": "relu", "name": "ReLU", "params": {} }
        ]
      },
      { "id": 7, "type": "adaptiveavgpool2d", "name": "AdaptiveAvgPool2d", "params": { "output_size": 1 }, "position": { "x": 840, "y": 100 } },
      { "id": 8, "type": "flatten", "name": "Flatten", "params": {}, "position": { "x": 1230, "y": 100 } },
      { "id": 9, "type": "linear", "name": "Classifier", "params": { "in_features": 64, "out_features": 10 }, "position": { "x": 840, "y": 320 } }
    ],
    "connections": [
      { "from": 1, "to": 2 },
      { "from": 2, "to": 7 },
      { "from": 7, "to": 8 },
      { "from": 8, "to": 9 }
    ]
  }
}
