{
  "format": "ai-model-tool",
  "version": "3.0",
  "name": "Untitled Model",
  "description": "Graph nodes are connected by arrows. Container children execute from top to bottom.",
  "graph": {
    "nodes": [
      {
        "id": 1,
        "type": "sequential",
        "name": "Sequential",
        "params": {},
        "position": {
          "x": 231,
          "y": 294
        },
        "execution": "sequence",
        "children": [
          {
            "id": 2,
            "type": "avgpool2d",
            "name": "AvgPool2d",
            "params": {
              "kernel_size": 2
            }
          }
        ]
      }
    ],
    "connections": []
  }
}